{"attempt_id":"attempt-001","attempt_version_vector_sha256":"1ef4868d51266829783b93f5d677e732f679862f8f43819008eb04a6341d6aac","candidate_protocol":"paraguibench.pipeline-implicit.component-validation.v1","component_checks":{"container_image_verified":"passed","image_manifest_held":"passed","owned_environment_closed":"passed","qcow2_snapshot_verified":"passed","reference_bundle_materialized":"passed","task_evaluator_completed":"passed","task_prepare_completed":"passed","typed_observation_captured":"passed"},"component_identity_sha256":"11578da71a8de5ba7f0ff344a87296bc941f7ea715a75870826e40acbcf9afbe","environment_identity_sha256":"96516cf34aaf408d769e8ea8b472776fa1086b9868688f36b5323921dbc1f10e","environment_protocol":"osworld.desktop.v1","evaluation_outcome":"PASSED","execution_outcome":"SUCCEEDED","receipt_kind":"paraguibench.pipeline-implicit.component.v1","run_id":"final797-ppt003-2e23d98e-001","schema_version":1,"score":1.0,"task_evaluation_protocol":"paraguibench.operation.image-classification.sha256.v1","task_id":"Operation-FileOperate-BatchOperationPPT-003","task_identity_sha256":"02ec464403701fecea61efa834e0ba4850ac44f5f7267d63041b7780a92f0e81"}
